chunk,chunk_index,source_file,chunk_length,timestamp,date_filed,bill_subtitle,bill_sponsor
"defined in Arkansas 14  Constitution, Amendment 56, § 1, shall adopt and pursue a comprehensive equal 15  employment hiring program designed to achieve a goal of increasing the 16  percentage of minority employees within the state department, agency, board, 17  commission, and institution of higher education and within the constitutional 18  office to a level that approximates the percentage of minorities in the 19  state's population.  20   (b)(1)  Every state department, agency, board, commission, and 21  institution of higher education and every constitutional officer shall report 22  to the Legislative Council on June 30 of each year regarding its efforts to 23  achieve its equal employment hiring program goal.  24    (2)  However, the report required of any institution by § 6 -63- 25  103 may be used in lieu of the report required under this subsection and 26  shall be filed as provided in this subsection.  27   (c)  The employee handbook or manual of every state department, agency, 28  board, commission, and institution of higher education and every employee 29  handbook or manual of every constitutional office shall include the following 30  statement in describing the equal employment opportunity hiring program 31  required under this section : 32    “The State of Arkansas does not discriminate in access to 33  employment opportunities or in employment or practices on the basis of race, 34  color, religion, sex, national origin, age, disability, or genetic 35  information.”  36   SB3       11 11/20/2024 2:38:30 PM   (b)  A statement included in an employee handbook or manual under this 1  section does not affect any preference given to veterans in employment.  2   3   SECTION 20.  Arkansas Code § 22 -9-203(i), concerning the award 4  procedure for public improvements generally, is amended to read as follows:  5   (i)  No contract providing for the making of major repairs or 6  alterations, for the erection of buildings or other structures, or for making 7",12,SB3.pdf,1997,2025-01-18 22:58:23,,14,
"3   SECTION 20.  Arkansas Code § 22 -9-203(i), concerning the award 4  procedure for public improvements generally, is amended to read as follows:  5   (i)  No contract providing for the making of major repairs or 6  alterations, for the erection of buildings or other structures, or for making 7  other permanent improvements shall be entered into by the state, any agency 8  of the state, any county, municipality, school district, or other local 9  taxing unit with any contractor in instances where all estimated costs of the 10  work shall exceed the sum of seventy -five thousand dollars ($75,000) unless 11  the bid documents contain statements which encourage the participation of 12  small, minority, and women's  business enterprises and veteran -owned business 13  enterprises . 14   15   SECTION 21.  Arkansas Code Title 25, Chapter 1, Subchapter 1, is 16  amended to add an additional section to read as follows:  17   25-1-130.  Prohibition of discrimination or preferential treatment by 18  state entities.  19   (a)  As used in this section, ""state"" means the State of Arkansas, a 20  city, a county, an institution of higher education, a public school district, 21  a public special school district, or a political subdivision or governmental 22  instrumentality of the state.  23   (b)  The state shall not discriminate against, or grant preferential 24  treatment to, an individual or group on the basis of race, sex, color, 25  ethnicity, or national origin in matters of state employment, public 26  education, or state procurement.  27   (c)  This section applies only to an action taken after the effective 28  date of this act.  29   (d)  This section does not:  30    (1)  Prohibit the consideration by the state of bona fide 31  qualifications based on sex that are reasonably necessary to the normal 32  functions of state employment, public education, or state procurement;  33    (2)  Invalidate a court order or consent decree that is in force 34  as of the effective",13,SB3.pdf,1997,2025-01-18 22:58:23,,14,
"Prohibit the consideration by the state of bona fide 31  qualifications based on sex that are reasonably necessary to the normal 32  functions of state employment, public education, or state procurement;  33    (2)  Invalidate a court order or consent decree that is in force 34  as of the effective date of this act;  35    (3)  Prohibit an action necessary to establish or maintain 36   SB3       12 11/20/2024 2:38:30 PM  eligibility for a federal program if ineligibility would demonstrably result 1  in a loss of federal funds to the state;  2    (4)  Affect any preference given to veterans in matters of state 3  employment, public education, or state procurement; or  4    (5)  Preempt state discrimination law or federal discrimination 5  law. 6   (e)  A person who knowingly violates this section is guilty of a Class 7  A misdemeanor.  8   (f)(1)  A person who believes his or her rights have been impacted 9  under this section may bring a civil action in circuit court to:  10     (A)  Enjoin a violation of this section; and  11     (B)  Recover reasonable court costs and attorney's fees.  12    (2)  In an action brought under this section, if the court finds 13  that a violation occurred, the court shall award:  14     (A)  Injunctive relief; and  15     (B)  Court costs and attorney's fees.   16   17   SECTION 22.  Arkansas Code § 25 -36-103 is repealed.  18   25-36-103. Agency contracting — Diversity.  19   (a)  A state agency shall include in all requests for proposals and 20  requests for qualifications, language that encourages minority participation 21  in each request for proposals and request for qualifications issued by the 22  state agency.  23   (b)(1)  State agency requests for proposals and requests for 24  qualifications shall take into consideration minority inclusion in the 25  proposed project.  26    (2)  Requests for proposals and requests for qualifications shall 27  provide that an applicant unable to include minority -owned businesses may 28",14,SB3.pdf,1996,2025-01-18 22:58:23,,14,
"agency requests for proposals and requests for 24  qualifications shall take into consideration minority inclusion in the 25  proposed project.  26    (2)  Requests for proposals and requests for qualifications shall 27  provide that an applicant unable to include minority -owned businesses may 28  explain the circumstances preventing minority inclusion.  29   30   SECTION 23.  DO NOT CODIFY.  Report to Legislative Council.  31   (a)  All state agencies shall begin developing a plan to implement this 32  act immediately upon the effective date of this act.  33   (b)(1)  If a state agency has not complied with this act within six (6) 34  months of the effective date of this act, the state agency shall submit a 35  detailed compliance plan to the Legislative Council or its appropriate 36   SB3       13 11/20/2024 2:38:30 PM  subcommittee within six (6) months of the effective date of this act stating 1  the: 2     (A)  Steps the state agency will take to comply with this 3  act;    4     (B)  Estimated time needed for the state agency to 5  implement changes necessary to comply with this act;  6     (C)  Individual responsible for overseeing the 7  implementation of this act; and  8     (D)  Description of the steps the state agency is taking to 9  address any failure to comply with this act.  10    (2)  The executive head of each state agency shall appear before 11  the Legislative Council or its appropriate subcommittee at the time the 12  compliance plan in subdivision (b)(1) of this section is submitted and 13  provide the following information:  14     (A)  Whether the state agency has been successful in 15  complying with the requirements of subdivision (b)(1) of this section;  16     (B)  An update on the current status of the necessary 17  changes;  18     (C)  The ongoing steps the state agency is taking to 19  address any failure to comply with this act; and  20     (D)  The anticipated date for when the state agency shall 21  be in full compliance with",15,SB3.pdf,1995,2025-01-18 22:58:23,,14,
"this section;  16     (B)  An update on the current status of the necessary 17  changes;  18     (C)  The ongoing steps the state agency is taking to 19  address any failure to comply with this act; and  20     (D)  The anticipated date for when the state agency shall 21  be in full compliance with this act.  22    (3)  If the state agency has not been successful in complying 23  with this act within nine (9) months of the appearance before the Legislative 24  Council or its appropriate subcommittee required in subdivision (b)(2) of 25  this section:  26     (A)  The executive head of the state agency shall appear 27  before the Legislative Council; and  28     (B)  The state agency shall provide an updated report and 29  compliance plan to the Legislative Council or its appropriate subcommittee, 30  including the anticipated date of compliance.  31   (c)(1)  If after one (1) year from the effective date of this act a 32  state agency has not complied fully with this act, in addition to the 33  executive head of the state agency, the cabinet -level department secretary 34  overseeing that state agency shall also appear before the Legislative Council 35  or its appropriate subcommittee to provide an update.  36   SB3       14 11/20/2024 2:38:30 PM    (2)  After the appearance under subdivision (c)(1) of this 1  section, every three (3) months until the state agency reaches full 2  compliance with this act, the executive head of the state agency and the 3  cabinet-level department secretary overseeing that state agency shall:  4     (A)  Appear before the Legislative Council or its 5  appropriate subcommittee; and  6     (B)  Provide an updated report and compliance plan to the 7  Legislative Council or its appropriate subcommittee, including the 8  anticipated date of compliance.  9    (3)  A cabinet -level department secretary is in violation of this 10  act if the secretary fails to be in full compliance with this act within 11  twenty-four (24) months of sine die",16,SB3.pdf,1999,2025-01-18 22:58:23,,14,
"the 7  Legislative Council or its appropriate subcommittee, including the 8  anticipated date of compliance.  9    (3)  A cabinet -level department secretary is in violation of this 10  act if the secretary fails to be in full compliance with this act within 11  twenty-four (24) months of sine die adjournment of the Ninety -Fourth General 12  Assembly meeting in regular session.  13   14   15   16   17   18   19   20   21   22   23   24   25   26   27   28   29   30   31   32   33   34   35   36",17,SB3.pdf,500,2025-01-18 22:58:23,,14,
